place,title,time,pay,date
서울 구로구,"평일(수,목) 야간 스토어매니저 모집합니다.",00:00~07:00,"시급9,180",1분전
경기 수원시,GS25 수원세지로점 스토어매니저 모집,시간협의,"시급9,160",2분전
경기 의정부,GS25신곡으뜸점 매주 목요일 야간근무자 모집,24:00~07:00,"시급9,160",2분전
경기 화성시,GS25 동탄골드점 평일야간(20시-06시)근무자모집,20:00~06:00,"시급10,500",2분전
경기 김포시,GS25 김포장기점 스토어매니저 모집,00:00~07:00,"시급9,500",3분전
충북 청주시,주말  야간 근무자 모집합니다.,00:00~09:00,"시급9,160",3분전
경기 광주시,GS25 오포우리점 스토어매니저 모집,17:00~00:00,"시급9,160",3분전
대구 수성구,GS25 대구 수성구(범어동 에일린의 뜰 아파트) 평일 월-금요일 근무자,시간협의,"시급9,160",4분전
서울 성북구,성북시네마점 평일 오후근무자 모집,21:00~01:00,"시급9,160",4분전
경기 의정부,"GS25신곡으뜸  매주 금,토요일 야간근무자 모집",24:00~07:00,"시급9,160",4분전
서울 전체,GS25홍대역사점에서 함께 근무하실 분을 모십니다(토일저녁),18:00~23:00,"시급9,160",4분전
경기 오산시,"평일 파트타임 근무자 모집합니다. (목,금)",11:00~16:00,"시급9,160",4분전
경기 성남시,편의점 토요일 야간 알바 하실 분 구합니다,00:00~07:30,"시급9,500",4분전
경기 성남시,평일(월.화)야간 근무자 모집합니다,23:00~06:30,"시급9,160",4분전
충북 청주시,주말  야간 근무자 모집합니다.,00:00~09:00,"시급9,160",4분전
인천 서구,평일오후 근무자 모집,17:00~24:00,"시급9,160",5분전
경기 의정부,"일,월 야간 근무자 모집(밤12시~아침7시까지)",24:00~07:00,"시급9,160",5분전
서울 성동구,주5일 평일 오후 아르바이트 구합니다,17:00~22:00,"시급9,160",5분전
충남 당진시,평일 아침근무 투잡가능 고령자가능,05:00~10:00,"시급10,000",5분전
경기 안산시,GS25 안산프라자점 주말오후 스토어매니저 모집,11:00~16:00,"시급9,160",6분전
충남 당진시,평일 아침근무 투잡가능 고령자가능,05:00~10:00,"시급10,000",6분전
서울 성북구,성북시네마점 평일 오후근무자 모집,21:00~01:00,"시급9,160",7분전
경기 고양시,GS25 중산현해점 평일저녁 근무자 모집,19:00~00:00,"시급9,160",7분전
경기 구리시,GS25 갈매행운점 주말야간 모집,21:00~08:00,"시급9,160",8분전
충남 당진시,평일 아침근무 투잡가능 고령자가능,05:00~10:00,"시급10,000",8분전
서울 서초구,"gs25잠원하이츠점  일, 월(20-01시)마감 알바 구합니다",20:00~01:00,"시급9,160",9분전
서울 서초구,"gs25잠원하이츠점  토,일,(20-01시)마감 알바 구합니다",20:00~01:00,"시급9,160",9분전
서울 노원구,토요일 1일  야간근무자 구합니다,22:00~09:00,"시급9,160",9분전
경기 광명시,GS25 광문초교점 스토어매니저 모집,시간협의,"시급9,160",9분전
서울 중랑구,GS25 면목한신점  주말야간 스토어매니저 모집,00:00~07:00,"시급9,160",9분전
대구 달서구,주말 야간알바 모집합니다(주2일),23:00~08:00,"시급9,160",10분전
경기 오산시,GS25오산세마대림점 토일 18~24시 아르바이트 모집,00:00~07:00,"시급9,160",11분전
인천 연수구,편의점  야간알바 구함(토 일 1명),00:00~07:00,"시급9,160",11분전
경기 고양시,GS25 마두백마점에서 평일 야간 근무자를 모집합니다,22:00~08:00,"시급9,160",11분전
경기 오산시,"오산궐동편의점/ 주말 금,토 1일야간근무자 구합니다",22:00~08:00,"시급9,160",11분전
경기 오산시,오산궐동편의점/ 평일오후근무자 구합니다.,12:00~17:00,"시급9,160",11분전
경기 안산시,GS25 일동빌라점 스토어매니저 모집,18:00~23:00,"시급9,160",11분전
경북 칠곡군,"GS25 왜관3공단점 평일(수,목,금)오후 마감 아르바이트 구합니다",18:00~23:00,"시급9,160",12분전
경기 고양시,GS25 중산현해점 주말야간 근무자 모집,00:00~07:00,"시급9,160",13분전
인천 연수구,GS25 송도트리플점 스토어매니저 모집,시간협의,"시급9,160",14분전
광주 남구,GS25 주월내안애점 스토어매니저 모집,시간협의,"시급9,160",14분전
경기 화성시,GS25동탄부명점 평일 야간 알바구합니다,22:00~06:00,"시급10,000",14분전
충남 아산시,GS25 아산비발디점 스토어매니저 모집,17:00~22:00,"시급9,160",14분전
대구 달서구,주말 야간알바 모집합니다(주2일),23:00~08:00,"시급9,160",14분전
경기 안산시,GS25 일동빌라점 평일 오후 근무자 모집,18:00~23:00,"시급9,200",15분전
제주 제주시,gs25연동중앙점에서 함께 근무하실분을 모집합니다,16:30~24:00,"시급9,200",15분전
서울 영등포,GS25 여의아일렉스점 주말 주간스토어매니저 모집,09:00~18:00,"시급9,160",15분전
서울 서초구,7호선내방역 gs25 수요일 또는 금요일 09시ㅡ16시 주1일 근무자 모집중,09:00~16:00,"시급9,160",15분전
경북 포항시,GS25상도센타점근무자구함,16:00~23:00,"시급9,160",16분전
경기 광명시,GS25광명M클러스터점 근무자 모집합니다.,시간협의,"시급9,160",16분전
