place,title,time,pay,date
서울 강남구,매머드커피 삼성점에서 오픈타임 아르바이트를 모집합니다,08:00~14:30,"시급11,005",18분전
서울 강남구,매머드커피 선정릉점 매니저 구합니다.,08:00~17:00,"월급2,400,000",1시간전
경기 성남시,[평일오후]매머드커피판교역점에서 함께 하실분을 모십니다.,12:30~15:00,"시급9,200",1시간전
경기 성남시,[주말오전]매머드커피판교역점에서 함께 하실분을 모십니다.,09:00~15:00,"시급9,200",1시간전
경기 성남시,[주말오전]매머드커피판교역점에서 함께 하실분을 모십니다.,09:00~15:00,"시급9,200",4시간전
경기 성남시,매머드커피 수내점에서 주말  파트타임 모집합니다.,09:30~15:00,"시급9,160",18시간전
서울 전체,강남역점 매머드 아르바이트 구합니다.,시간협의,"시급9,160",01/16
서울 강남구,매머드커피 삼성점에서 오픈타임 아르바이트를 모집합니다,08:00~14:30,"시급11,005",01/15
서울 중구,[평일]매머드커피 퍼시픽타워점에서 같이 즐겁게 일할 분 찾아요,12:00~19:30,"시급9,160",01/15
서울 중구,매머드커피 소공점 주말 바리스타 모집,시간협의,"시급9,160",01/14
서울 중구,[평일 오후]매머드커피 퍼시픽타워점에서 같이 즐겁게 일할 분 찾아요,12:00~19:30,"시급9,160",01/14
서울 중구,매머드커피 소공점 주말 바리스타 모집,시간협의,"시급9,160",01/14
서울 중구,[평일 오후]매머드커피 퍼시픽타워점에서 같이 즐겁게 일할 분 찾아요,12:00~19:30,"시급9,160",01/13
서울 중구,매머드커피 소공점 주말 바리스타 모집,시간협의,"시급9,160",01/11
서울 영등포,매머드커피 여의도S점 평일오픈 바리스타 모집합니다.,06:00~14:00,"시급9,160",01/11
서울 강남구,매머드커피 역삼역점에서 토요일 근무자를 모집합니다.,10:00~19:00,"시급9,160",01/10
서울 강남구,매머드커피 역삼역점에서 평일 오픈 근무자를 모집합니다.,07:00~14:00,"시급9,160",01/10
서울 중구,매머드커피 소공점 주말 바리스타 모집,시간협의,"시급9,160",01/09
서울 중구,매머드커피 소공점 주말 바리스타 모집,시간협의,"시급9,160",01/08
