place,title,time,pay,date
경기 부천시,에그드랍 부천시청점 (주말저녁근무),18:30~22:30,"시급9,160",34분전
경기 화성시,에그드랍 동탄호수점 주말오후 아르바이트 구인,16:00~20:30,"시급9,500",2시간전
전북 익산시,에그드랍 익산영등점 주말 직원모집. 주부우대,시간협의,"시급9,160",3시간전
부산 수영구,에그드랍 수영점 주5일 그리고 주4일파트타임 지원해주세요~,시간협의,"시급9,160",5시간전
경기 수원시,"에그드랍 광교 앨리웨이점에서 평일오픈/마감 알바,직원 구합니다/주휴수당지급",시간협의,"시급9,500",6시간전
경기 수원시,"에그드랍 광교 앨리웨이점에서 평일오픈/마감 알바,직원 구합니다/주휴수당지급",시간협의,"시급9,500",6시간전
경기 수원시,"에그드랍 광교 앨리웨이점에서 평일오후 알바,직원 구합니다/주휴수당지급",16:00~22:30,"시급9,500",7시간전
경기 수원시,"에그드랍 광교 앨리웨이점에서 평일오후 알바,직원 구합니다/주휴수당지급",16:00~22:30,"시급9,500",7시간전
경기 수원시,"에그드랍 광교 앨리웨이점에서 평일오후 알바,직원 구합니다/주휴수당지급",16:00~22:30,"시급9,500",7시간전
서울 송파구,에그드랍 석촌호수점(송파구) 평일 오전 알바(파트타이머)를 모집합니다.,08:00~15:30,"시급9,160",15시간전
경기 성남시,"[EGG DROP]에그드랍 판교역점 파트타임 모집(목,금/낮)",11:00~14:00,"시급9,160",22시간전
경기 안산시,[안산고잔점] 에그드랍 안산고잔점 스탭 모집합니다.,시간협의,"시급9,160",22시간전
경기 화성시,에그드랍 동탄나루마을점 직원 및 아르바이트 모집,시간협의,"시급9,160",01/16
경기 용인시,용인 보정동 에그드랍 오전 알바 구합니다,10:00~15:00,"시급9,160",01/16
전북 전주시,에그드랍 전주에코시티점 (주말)알바 구합니다.,09:00~14:00,"시급9,160",01/13
경기 화성시,에그드랍 동탄역점 근무자 모집합니다.,시간협의,"시급9,160",01/10
전북 익산시,에그드랍 익산영등점  직원 및 알바 모집,시간협의,"시급9,160",01/09
경기 용인시,에그드랍 용인 역북점 파트타이머 모집,시간협의,"시급9,200",01/09
대전 서구,에그드랍 대전관저점 주말 (오전)  알바 모집합니다,09:30~16:00,"시급9,160",01/08
서울 송파구,에그드랍 석촌호수점(송파구) 주말 오후 알바(파트타이머)를 모집합니다.,12:00~19:30,"시급9,160",01/08
서울 송파구,에그드랍 석촌호수점(송파구) 주말 오전 알바(파트타이머)를 모집합니다.,08:00~15:30,"시급9,160",01/08
서울 송파구,에그드랍 석촌호수점(송파구) 평일 오후 알바(파트타이머)를 모집합니다.,12:00~19:30,"시급9,160",01/08
서울 송파구,에그드랍 석촌호수점(송파구) 평일 오전 알바(파트타이머)를 모집합니다.,08:00~15:30,"시급9,160",01/08
경기 화성시,에그드랍도 먹고 일도 하고,09:00~02:00,"시급9,160",01/07
서울 강남구,에그드랍 양재역점 직원/ 파트타이머 모집,시간협의,"시급9,160",01/06
경기 안산시,[안산고잔점] 에그드랍 안산고잔점 매니저 모집합니다.,시간협의,"월급2,200,000",01/05
인천 전체,에그드랍인천송도현대아울렛점에서 함께 일할 직원모집,시간협의,"시급9,160",01/02
인천 전체,에그드랍인천송도현대아울렛점에서 함께 일할 직원모집,시간협의,"시급9,160",01/02
인천 전체,에그드랍인천송도현대아울렛점에서 함께 일할 직원모집,시간협의,"시급9,160",01/02
인천 전체,에그드랍인천송도현대아울렛점에서 함께 일할 직원모집,시간협의,"시급9,160",01/02
인천 전체,에그드랍인천송도현대아울렛점에서 함께 일할 직원모집,시간협의,"시급9,160",01/02
